<?xml version="1.0" encoding="UTF-8" ?>

<feladat xsi:noNamespaceSchemaLocation="KJ_ertoxsd.xsd" xmlns:xsi="http://www.w3.org/2001/XMLSchema-instance">
    <A Aa="a01">
        <Ab>
            <Abx></Abx>
            <Aby></Aby>
        </Ab>
        <Ac>
            <Acd></Acd>
            <Ace></Ace>
        </Ac>
    </A>
    <A_B>
        <A_Bc></A_Bc>
    </A_B>
    <B Ba="a02">
        <Bb>
            <Bbx></Bbx>
            <Bby></Bby>
        </Bb>
    </B>
    <C Ca="a03">
        <Cb></Cb>
    </C>
</feladat>